{
    "@id": "cmip6plus:source/id/noresm2-lm",
    "@type": "cmip:source_id",
    "source-id:name": "NorESM2-LM",
    "source-id:label": "NorESM2-LM",
    "source-id:label_extended": "NorESM2-LM (low atmosphere-medium ocean resolution, GHG concentration driven)",
    "source-id:release_year": 2017,
    "source-id:activity_participation": {
        "@set": [
            {
                "@id": "cmip6plus:activity/CMIP"
            },
            {
                "@id": "cmip6plus:activity/LESFMIP"
            }
        ]
    },
    "source-id:cohort": "published",
    "source-id:institution_id": {
        "@id": "mip-cmor-tables:institutions/ncc"
    },
    "source-id:contributers": {
        "@set": {}
    },
    "source-id:license": {
        "@nest": {
            "license:type": {
                "@id": "mip-cmor-tables:license/cc-by-4.0"
            },
            "license:exceptions_contact": "@met.no <- noresm-ncc",
            "license:source_specific_info": ""
        }
    },
    "source-id:model_component": {
        "@list": [
            {
                "@id": "cmip6plus:model/componets/osloaero"
            },
            {
                "@id": "cmip6plus:model/componets/cam-oslo"
            },
            {
                "@id": "cmip6plus:model/componets/oslochemsimp"
            },
            {
                "@id": "cmip6plus:model/componets/clm"
            },
            {
                "@id": "cmip6plus:model/componets/cism"
            },
            {
                "@id": "cmip6plus:model/componets/micom"
            },
            {
                "@id": "cmip6plus:model/componets/hamocc"
            },
            {
                "@id": "cmip6plus:model/componets/cice"
            }
        ]
    }
}